{
  "icao": "KPHX",
  "label": "Phoenix/Sky Harbor, AZ",
  "schema_version": "1.1.0",
  "stats": [
    {
      "bias_f": -0.04,
      "bias_hi_f": null,
      "bias_lo_f": null,
      "lead_day": 1,
      "mae_f": 0.04,
      "mae_hi_f": null,
      "mae_lo_f": null,
      "min_sample_flag": true,
      "n": 1,
      "n_blocks": 1,
      "n_dates": 1,
      "no_detectable_bias": true,
      "skill": 0.0,
      "skill_hi": 0.0,
      "skill_lo": 0.0,
      "source": "raw_nbm",
      "variable": "max"
    },
    {
      "bias_f": -1.04,
      "bias_hi_f": null,
      "bias_lo_f": null,
      "lead_day": 1,
      "mae_f": 1.04,
      "mae_hi_f": null,
      "mae_lo_f": null,
      "min_sample_flag": true,
      "n": 1,
      "n_blocks": 1,
      "n_dates": 1,
      "no_detectable_bias": true,
      "skill": -25.0,
      "skill_hi": null,
      "skill_lo": null,
      "source": "baseline",
      "variable": "max"
    },
    {
      "bias_f": 0.46,
      "bias_hi_f": null,
      "bias_lo_f": null,
      "lead_day": 1,
      "mae_f": 0.46,
      "mae_hi_f": null,
      "mae_lo_f": null,
      "min_sample_flag": true,
      "n": 1,
      "n_blocks": 1,
      "n_dates": 1,
      "no_detectable_bias": true,
      "skill": -10.5,
      "skill_hi": null,
      "skill_lo": null,
      "source": "challenger",
      "variable": "max"
    },
    {
      "bias_f": 3.92,
      "bias_hi_f": null,
      "bias_lo_f": null,
      "lead_day": 2,
      "mae_f": 3.92,
      "mae_hi_f": null,
      "mae_lo_f": null,
      "min_sample_flag": true,
      "n": 1,
      "n_blocks": 1,
      "n_dates": 1,
      "no_detectable_bias": true,
      "skill": 0.0,
      "skill_hi": 0.0,
      "skill_lo": 0.0,
      "source": "raw_nbm",
      "variable": "max"
    },
    {
      "bias_f": 2.92,
      "bias_hi_f": null,
      "bias_lo_f": null,
      "lead_day": 2,
      "mae_f": 2.92,
      "mae_hi_f": null,
      "mae_lo_f": null,
      "min_sample_flag": true,
      "n": 1,
      "n_blocks": 1,
      "n_dates": 1,
      "no_detectable_bias": true,
      "skill": 0.255,
      "skill_hi": null,
      "skill_lo": null,
      "source": "baseline",
      "variable": "max"
    },
    {
      "bias_f": 4.42,
      "bias_hi_f": null,
      "bias_lo_f": null,
      "lead_day": 2,
      "mae_f": 4.42,
      "mae_hi_f": null,
      "mae_lo_f": null,
      "min_sample_flag": true,
      "n": 1,
      "n_blocks": 1,
      "n_dates": 1,
      "no_detectable_bias": true,
      "skill": -0.128,
      "skill_hi": null,
      "skill_lo": null,
      "source": "challenger",
      "variable": "max"
    },
    {
      "bias_f": 1.06,
      "bias_hi_f": null,
      "bias_lo_f": null,
      "lead_day": 1,
      "mae_f": 1.06,
      "mae_hi_f": null,
      "mae_lo_f": null,
      "min_sample_flag": true,
      "n": 1,
      "n_blocks": 1,
      "n_dates": 1,
      "no_detectable_bias": true,
      "skill": 0.0,
      "skill_hi": 0.0,
      "skill_lo": 0.0,
      "source": "raw_nbm",
      "variable": "min"
    },
    {
      "bias_f": 0.06,
      "bias_hi_f": null,
      "bias_lo_f": null,
      "lead_day": 1,
      "mae_f": 0.06,
      "mae_hi_f": null,
      "mae_lo_f": null,
      "min_sample_flag": true,
      "n": 1,
      "n_blocks": 1,
      "n_dates": 1,
      "no_detectable_bias": true,
      "skill": 0.943,
      "skill_hi": null,
      "skill_lo": null,
      "source": "baseline",
      "variable": "min"
    },
    {
      "bias_f": 1.56,
      "bias_hi_f": null,
      "bias_lo_f": null,
      "lead_day": 1,
      "mae_f": 1.56,
      "mae_hi_f": null,
      "mae_lo_f": null,
      "min_sample_flag": true,
      "n": 1,
      "n_blocks": 1,
      "n_dates": 1,
      "no_detectable_bias": true,
      "skill": -0.472,
      "skill_hi": null,
      "skill_lo": null,
      "source": "challenger",
      "variable": "min"
    },
    {
      "bias_f": -0.92,
      "bias_hi_f": null,
      "bias_lo_f": null,
      "lead_day": 2,
      "mae_f": 0.92,
      "mae_hi_f": null,
      "mae_lo_f": null,
      "min_sample_flag": true,
      "n": 1,
      "n_blocks": 1,
      "n_dates": 1,
      "no_detectable_bias": true,
      "skill": 0.0,
      "skill_hi": 0.0,
      "skill_lo": 0.0,
      "source": "raw_nbm",
      "variable": "min"
    },
    {
      "bias_f": -1.92,
      "bias_hi_f": null,
      "bias_lo_f": null,
      "lead_day": 2,
      "mae_f": 1.92,
      "mae_hi_f": null,
      "mae_lo_f": null,
      "min_sample_flag": true,
      "n": 1,
      "n_blocks": 1,
      "n_dates": 1,
      "no_detectable_bias": true,
      "skill": -1.087,
      "skill_hi": null,
      "skill_lo": null,
      "source": "baseline",
      "variable": "min"
    },
    {
      "bias_f": -0.42,
      "bias_hi_f": null,
      "bias_lo_f": null,
      "lead_day": 2,
      "mae_f": 0.42,
      "mae_hi_f": null,
      "mae_lo_f": null,
      "min_sample_flag": true,
      "n": 1,
      "n_blocks": 1,
      "n_dates": 1,
      "no_detectable_bias": true,
      "skill": 0.543,
      "skill_hi": null,
      "skill_lo": null,
      "source": "challenger",
      "variable": "min"
    }
  ],
  "window": {
    "basis": "target_date",
    "days": 30,
    "end": "2023-07-16",
    "start": "2023-06-17"
  }
}
